{
  "vegetable": [
    {
      "name": "土豆",
      "emoji": "🥔"
    },
    {
      "name": "胡萝卜",
      "emoji": "🥕"
    },
    {
      "name": "花菜",
      "emoji": "🌼",
      "more": true
    },
    {
      "name": "西兰花",
      "emoji": "🥦"
    },
    {
      "name": "白萝卜",
      "emoji": "🥣",
      "more": true
    },
    {
      "name": "西葫芦",
      "emoji": "🥒",
      "more": true
    },
    {
      "name": "番茄",
      "emoji": "🍅",
      "alias": "西红柿"
    },
    {
      "name": "芹菜",
      "emoji": "🥬",
      "more": true
    },
    {
      "name": "黄瓜",
      "emoji": "🥒"
    },
    {
      "name": "洋葱",
      "emoji": "🧅"
    },
    {
      "name": "青椒",
      "emoji": "🫑"
    },
    {
      "name": "莴笋",
      "emoji": "🎍",
      "more": true
    },
    {
      "name": "菌菇",
      "emoji": "🍄"
    },
    {
      "name": "茄子",
      "emoji": "🍆"
    },
    {
      "name": "豆腐",
      "emoji": "🍲"
    },
    {
      "name": "包菜",
      "emoji": "🥗"
    },
    {
      "name": "白菜",
      "emoji": "🥬"
    },
    {
      "name": "菠菜",
      "emoji": "🥬",
      "more": true
    },
    {
      "name": "空心菜",
      "emoji": "🌿",
      "more": true
    },
    {
      "name": "玉米",
      "emoji": "🌽",
      "more": true
    },
    {
      "name": "苦瓜",
      "emoji": "🥒",
      "more": true
    },
    {
      "name": "辣椒",
      "emoji": "🌶️",
      "more": true
    },
    {
      "name": "豆角",
      "emoji": "🫛",
      "more": true
    },
    {
      "name": "冬瓜",
      "emoji": "🍈",
      "more": true
    },
    {
      "name": "生菜",
      "emoji": "🥬",
      "more": true
    },
    {
      "name": "豆芽",
      "emoji": "🌱",
      "more": true
    },
    {
      "name": "青菜",
      "emoji": "🥬",
      "more": true
    }
  ],
  "meat": [
    {
      "name": "午餐肉",
      "emoji": "🥓",
      "more": true
    },
    {
      "name": "香肠",
      "emoji": "🌭"
    },
    {
      "name": "腊肠",
      "emoji": "🌭",
      "more": true
    },
    {
      "name": "鸡肉",
      "emoji": "🐤"
    },
    {
      "name": "猪肉",
      "emoji": "🐷"
    },
    {
      "name": "鸡蛋",
      "emoji": "🥚"
    },
    {
      "name": "虾",
      "emoji": "🦐"
    },
    {
      "name": "牛肉",
      "emoji": "🐮"
    },
    {
      "name": "骨头",
      "emoji": "🦴",
      "more": true
    },
    {
      "name": "鱼",
      "emoji": "🐟"
    },
    {
      "name": "鸭肉",
      "emoji": "🦆",
      "more": true
    },
    {
      "name": "羊肉",
      "emoji": "🐑",
      "more": true
    }
  ],
  "staple": [
    {
      "name": "面食",
      "emoji": "🍝"
    },
    {
      "name": "面包",
      "emoji": "🍞"
    },
    {
      "name": "米",
      "emoji": "🍚"
    },
    {
      "name": "方便面",
      "emoji": "🍜"
    }
  ],
  "tools": [
    {
      "name": "烤箱",
      "emoji": "",
      "icon": "i-mdi-toaster-oven"
    },
    {
      "name": "空气炸锅",
      "emoji": "",
      "icon": "i-fe-frying-pan"
    },
    {
      "name": "微波炉",
      "emoji": "",
      "icon": "i-ic-outline-microwave"
    },
    {
      "name": "电饭煲",
      "emoji": "",
      "icon": "i-gg-smart-home-cooker"
    },
    {
      "label": "一口能炒又能煮的大锅",
      "name": "一口大锅",
      "emoji": "",
      "icon": "i-mdi-pot-steam-outline"
    }
  ]
}
